<enigma
xmlns:xsi="http://www.w3.org/2001/XMLSchema-instance"
xsi:noNamespaceSchemaLocation="enigma.xsd"
title="Boîte de Pandore"
reference="Le cube de jeux. #171"
image="img/derek.svg">
	<intro> Pandore Persimmons est l'animateur d'un jeu questionnaire durant lequel les concurrents méritent le droit d'ouvrir une des boites que l'on voit dans l'illustration. Le contenu des boites peut être très intéressant ou... nul. Pandore essaie de convaincre les participants d'abandonner leur chance d'ouvrir une boite en leur offrant de l'argent. Cette fois-ci, ça n'a pas marché. A l'aide des indices ci-dessous, trouvez l'ordre dans lequel les concurrents ouvriront les boites, quelle boite ils ouvriront et ce qu'ils gagneront. </intro>
	<style>
		.avant: {
		position: absolute,
		right: .75in,
		bottom: .75in,
		height: 23pc
		},
		.tableau: {
		font-size: 11pt
		},
		.indices ol: {
		font-size: 11pt,
		columns: 2,
		padding: 0,
		column-rule: 1px dotted black
		},
		.indices li: {
		margin: 0 0 0.5em 0,
		margin-left: 1.5em,
		page-break-inside: avoid
		},
		p.intro: {
		line-height: 1.2,
		margin: 1em 0
		},
		.colonnes: {
		grid-template-columns: auto
		},
		.truc: {
		left: 18pc,
		bottom: 7pc
		}
	</style>
	<props>
		<prop id="boite" name="Boite" ordered="true">
			<choice id="no1" abbr="no1">1</choice>
			<choice id="no2" abbr="no2">2</choice>
			<choice id="no3" abbr="no3">3</choice>
			<choice id="no4" abbr="no4">4</choice>
			<choice id="no5" abbr="no5">5</choice>
			<choice id="no6" abbr="no6">6</choice>
		</prop>
		<prop id="concurrents" name="Concurrents">
			<choice id="jim" abbr="J">Jim</choice>
			<choice id="lynne" abbr="L">Lynne</choice>
			<choice id="michael" abbr="M">Michaël</choice>
			<choice id="robert" abbr="R">Robert</choice>
			<choice id="sharon" abbr="Sh">Sharon</choice>
			<choice id="susanne" abbr="Su">Suzanne</choice>
		</prop>
		<prop id="prix" name="Prix" ordered="true">
			<choice id="savon" abbr="S" attribute="type=objet">Savon</choice>
			<choice id="cuillere" abbr="C" attribute="type=objet">Cuillère</choice>
			<choice id="a50" abbr="50¢" attribute="type=argent">0,50$</choice>
			<choice id="a100" abbr="100" attribute="type=argent">100$</choice>
			<choice id="a1k" abbr="1k" attribute="type=argent">1000$</choice>
			<choice id="a5k" abbr="5k" attribute="type=argent">5000$</choice>
		</prop>
		<prop id="ordre" name="Ordre" ordered="true">
			<choice id="premier" abbr="1er">Premier</choice>
			<choice id="deuxieme" abbr="2e">Deuxième</choice>
			<choice id="troisieme" abbr="3e">Troisième</choice>
			<choice id="quatrieme" abbr="4e">Quatrième</choice>
			<choice id="cinquieme" abbr="5e">Cinquième</choice>
			<choice id="sixieme" abbr="6e">Sixième</choice>
		</prop>
	</props>
	<clues>
		<!-- Operators: 
			= : Equals to
			!= : Different from
			&lt; : Lower than
			&gt; : Higher than
		-->
		<clue>
			<part formula="ordre#≠boite#">L'<ref prop="ordre">ordre des concurrents</ref> ne correspond jamais au <ref prop="numero">numéro de la boite</ref>.</part>
		</clue>
		<clue>
			<part formula="concurrents.lynne=ordre.no2"><ref prop="concurrents.lynne">Lynne</ref>, qui a ouvert la <ref prop="ordre.no2">deuxième boite</ref>,</part>
			<part formula="concurrents.lynne:prix=[type=argent]">a gagné de l'<ref prop="prix">argent</ref>,</part>
			<part formula="concurrents.sharon:prix=[type=argent];concurrents.lynn:prix#&lt;concurrents.sharon:prix#;">mais moins que <ref prop="concurrents.sharon">Sharon</ref></part>
			<part formula="concurrents.lynne:ordre#-concurrents.sharon:ordre#&gt;1;">dont le tour précédait celui de <ref prop="concurrents.lynne">Lynne</ref></part>
			<part>mais n'était pas <ref prop="ordre">immédiatement avant</ref>.</part>
		</clue>
		<clue>
			<part><ref prop="concurrents.michael">Michael</ref>, dont le tour est venu après celui du gagnant de <ref prop="prix.100">100$</ref>,</part>
			<part>a ouvert une boîte à droite de celle du <ref prop="prix.5k">gagnant</ref>, mais pas <ref prop="ordre">juste à côté</ref>.</part>
		</clue>
		<clue>
			<part>La boite contenant un morceau de <ref prop="prix.savon">savon</ref> se trouvait juste à gauche de celle ouverte par le <ref prop="ordre.5">cinquième concurrent</ref>.</part>
			<part>La boite choisie par <ref prop="concurrents.jim">Jim</ref> était à gauche que ces deux boîtes.</part>
		</clue>
		<clue>
			<part>Le tour du concurrent qui a gagné une <ref prop="prix.cuillere">cuillère de bois</ref> était juste avant celui du concurrent qui a gagné <ref prop="prix.50">0,50$</ref>.</part>
			<part>La boite avec la cuillere était juste à droite de celle contenant <ref prop="prix.1000">1000$</ref>.</part>
		</clue>
		<clue>
			<part><ref prop="concurrents.susanne">Susanne</ref> a ouvert la boite juste a droite de celle choisie par <ref prop="concurrents.robert">Robert</ref></part>
			<part>qui a joué juste après elle.</part>
		</clue>
		<clue>
			<part>Les <ref prop="concurrents">hommes</ref> n'ont pas ouvert de boites <ref prop="ordre">adjacentes</ref>.</part>
			<part>Le gagnant de <ref prop="prix.5k">5000$</ref> est la seule personne dont la boite se trouvait à droite de celle d'un <ref prop="concurrents">homme</ref></part>
			<part>et à gauche de celle d'une <ref prop="concurrents">femme</ref>.</part>
		</clue>
	</clues>
</enigma>